{
  "$schema": "../../schemas/service.schema.json",
  "id": "code-runner",
  "name": "Ejecutor de código IA",
  "category": "platform",
  "description": "Recibe un fragmento de Python y lo ejecuta dentro de la jaula donde ya corre el servicio, con timeout y salida acotada.",
  "teaches": "El caso de uso que motiva el repositorio: ejecutar código que nadie ha revisado sin entregarle el equipo.",
  "port": 8803,
  "kind": "python",
  "entrypoint": "app.py",
  "command": "python3",
  "args": [],
  "policy": "service-sandbox",
  "runtimes": [
    "bwrap",
    "unshare"
  ],
  "healthPath": "/health"
}
