{
  "$schema": "../../schemas/service.schema.json",
  "id": "containment-api",
  "name": "API de contención",
  "category": "containment",
  "description": "Expone como API las mismas sondas que mide la suite, pero de forma continua mientras el servicio corre.",
  "teaches": "Que la contención hay que comprobarla mientras algo se ejecuta, no solo al arrancar.",
  "port": 8802,
  "kind": "python",
  "entrypoint": "app.py",
  "command": "python3",
  "args": [],
  "policy": "service-sandbox",
  "runtimes": [
    "bwrap",
    "unshare"
  ],
  "healthPath": "/health"
}
